{
  "findings_version": "repository-qa-findings-1.0.0",
  "audit_date": "2026-07-25",
  "audited_commit": "1b6130793d7b305605115dea255de15e89d2b94f",
  "status": "review",
  "summary": {
    "critical": 0,
    "high": 3,
    "medium": 7,
    "low": 3,
    "total": 13
  },
  "findings": [
    {
      "finding_id": "QA-SEC-001",
      "severity": "high",
      "confidence": "high",
      "category": "security",
      "title": "Known vulnerabilities in required development and build tooling",
      "status": "resolved",
      "evidence": [
        "pip-audit reports pytest 8.4.2 affected by PYSEC-2026-1845 in both environments",
        "pyproject.toml requires pytest>=8.3,<9, excluding patched pytest 9.0.3",
        "pip-audit reports transformer setuptools 78.1.0 affected by PYSEC-2025-49 and PYSEC-2026-3447",
        "QA-101 source constraints require pytest>=9.0.3,<10 and setuptools>=83,<84",
        "both environments now use pytest 9.1.1 and setuptools 83.0.0 and pip-audit exits zero",
        "the PostgreSQL-backed standard suite passes 291 tests with one expected skip and the transformer suite passes 292 tests"
      ],
      "impact": "Fresh CI installs necessarily select a vulnerable pytest range, and transformer package operations use vulnerable build tooling.",
      "remediation": "Validate pytest 9.0.3 compatibility, update source constraints, require setuptools>=83.0.0, rebuild both environments, and add dependency audit to CI.",
      "verification": "Verified: both environment audits exit zero and both complete PostgreSQL-backed test suites pass.",
      "paper_gate": true
    },
    {
      "finding_id": "QA-CI-001",
      "severity": "high",
      "confidence": "high",
      "category": "ci",
      "title": "CI does not exercise the selected transformer path",
      "status": "resolved",
      "evidence": [
        "CI installs only the Python 3.13 dev extra",
        "the Python 3.12 transformer requirements are absent from CI",
        "only the local transformer environment executes all 291 tests",
        "QA-103 defines independent hash-locked standard and CPU-transformer Linux jobs with separate coverage outputs",
        "the transformer job enforces offline Hugging Face operation, installs one isolated CPU Torch wheel, and explicitly deselects GPU acceptance",
        "fresh Linux simulations pass 293 standard tests and 294 CPU-transformer tests using disposable PostgreSQL while governed data and artifacts are unavailable",
        "GitHub Actions run 30161131645 passes both standard and transformer-cpu on commit 3c37677e08711697de6a89fde5b59231fef377b3"
      ],
      "impact": "The selected model path can regress while required remote CI remains green.",
      "remediation": "Add a bounded Python 3.12 CPU transformer CI job and explicitly separate GPU-only acceptance tests.",
      "verification": "Verified: GitHub Actions run 30161131645 passes both jobs and the transformer job produces its separate coverage report.",
      "paper_gate": true
    },
    {
      "finding_id": "QA-REPRO-001",
      "severity": "high",
      "confidence": "high",
      "category": "reproducibility",
      "title": "Fresh-environment dependencies are not fully locked",
      "status": "resolved",
      "evidence": [
        "standard dependencies are version ranges without a lock file or hashes",
        "tokenizer requirements use exact versions without hashes",
        "the CUDA torch hash is a comment rather than an enforced require-hashes install",
        "QA-102 adds five reviewed platform-specific lock artifacts with enforced SHA-256 hashes",
        "clean Python 3.13 standard and Python 3.12 transformer environments installed only the reviewed third-party locks plus no-dependency editable Git source",
        "both clean environments passed pip check and their complete PostgreSQL-backed suites",
        "the CUDA index is isolated to one no-dependency torch 2.13.0+cu130 wheel with its official SHA-256 digest enforced"
      ],
      "impact": "Future environments may resolve different transitive packages than the accepted validation environment.",
      "remediation": "Generate reviewed standard and transformer lock files with hashes and deterministic rebuild/update instructions.",
      "verification": "Verified: clean hashed standard and transformer installs pass pip check and both complete PostgreSQL-backed suites; exact lock digests and package-source boundaries are repository-tested.",
      "paper_gate": true
    },
    {
      "finding_id": "QA-TEST-001",
      "severity": "medium",
      "confidence": "high",
      "category": "testing",
      "title": "Coverage gaps are measured but not enforced",
      "status": "resolved",
      "evidence": [
        "the standard and Linux CPU-transformer jobs independently fail below 69 percent combined statement and branch coverage",
        "focused offline, timeout, non-zero exit, and malformed-output tests raise model_selection.py coverage from 49 to 53 percent",
        "local standard coverage is 69.36 percent, local CUDA-transformer coverage is 70.74 percent, and remote Linux CPU-transformer coverage is 69.02 percent",
        "GitHub Actions run 30163081497 passes both independent floors"
      ],
      "impact": "Critical orchestration and error branches can lose coverage without failing CI.",
      "remediation": "Add focused failure-path tests and a non-decreasing branch-coverage ratchet for both environments.",
      "verification": "Verified in local profile reports and GitHub Actions run 30163081497.",
      "paper_gate": false
    },
    {
      "finding_id": "QA-DB-001",
      "severity": "medium",
      "confidence": "high",
      "category": "database",
      "title": "Alembic cannot detect model-to-migration drift",
      "status": "open",
      "evidence": [
        "alembic check reports that env.py supplies no SQLAlchemy MetaData",
        "the sole head and database current revision both remain 0004_temporal_split",
        "disposable migration integration tests pass"
      ],
      "impact": "A future schema-model change can omit a migration without an automated drift warning.",
      "remediation": "Define authoritative SQLAlchemy metadata in the migration environment and add alembic check to CI.",
      "verification": "alembic check and disposable upgrade tests pass from a clean checkout.",
      "paper_gate": false
    },
    {
      "finding_id": "QA-GIT-001",
      "severity": "medium",
      "confidence": "high",
      "category": "repository",
      "title": "The public repository main branch is unprotected",
      "status": "resolved",
      "evidence": [
        "GitHub branch API reports main_protected=false",
        "origin/main matches the audited commit",
        "the latest CI run for the audited commit succeeded",
        "QA-104 GitHub API verification reports strict required standard and transformer-cpu contexts",
        "pull-request delivery, administrator enforcement, linear history, and conversation resolution are enabled",
        "force pushes and branch deletion are disabled"
      ],
      "impact": "Evidence and governance controls can be changed through direct or destructive pushes without a review gate.",
      "remediation": "Protect main, require CI, and block force pushes and branch deletion.",
      "verification": "Verified: the GitHub branch API reports the accepted protection controls and both required job contexts for main.",
      "paper_gate": false
    },
    {
      "finding_id": "QA-SEC-002",
      "severity": "medium",
      "confidence": "high",
      "category": "security",
      "title": "Security checks are manual and not merge gates",
      "status": "resolved",
      "evidence": [
        "Gitleaks 8.28.0 scans complete Git history with redaction and rejects an ephemeral controlled secret fixture",
        "both runtime jobs strictly audit hash-locked PyPI environments and validate privacy-bounded CycloneDX SBOMs",
        "the digest-pinned upgraded PostgreSQL image passes the Trivy HIGH and CRITICAL actionable-vulnerability gate with individually justified expiring gosu exceptions",
        "Dependabot checks pip, GitHub Actions, and Docker weekly, and every third-party Action uses an immutable commit",
        "GitHub Actions run 30162536790 passes standard, transformer-cpu, and security; all three contexts are strict required main checks"
      ],
      "impact": "Credential, dependency, image, or workflow supply-chain regressions may merge undetected.",
      "remediation": "Add redacted secret scanning, pip-audit, SBOM and image gates, automated dependency updates, and immutable Action pins.",
      "verification": "Verified in GitHub Actions run 30162536790 and the main branch-protection API on 2026-07-25.",
      "paper_gate": false
    },
    {
      "finding_id": "QA-TYPE-001",
      "severity": "medium",
      "confidence": "high",
      "category": "typing",
      "title": "No static type-checking gate exists",
      "status": "open",
      "evidence": [
        "no mypy, Pyright, or equivalent configuration is tracked",
        "CI runs linting and tests but no type checker",
        "production modules expose annotated protocols and typed boundaries that are not statically verified"
      ],
      "impact": "Interface and nullable/dynamic errors remain dependent on runtime path coverage.",
      "remediation": "Adopt one checker incrementally, establish a clean scoped baseline, and ratchet the protected module set.",
      "verification": "The configured checker passes locally and in required CI for its declared scope.",
      "paper_gate": false
    },
    {
      "finding_id": "QA-MAINT-001",
      "severity": "medium",
      "confidence": "medium",
      "category": "maintainability",
      "title": "Critical orchestration is concentrated in large functions",
      "status": "open",
      "evidence": [